{
  "version": "1.0.0",
  "createdAt": "2026-02-18T00:00:00Z",
  "customerName": "田村友秀",
  "title": "木造倉庫 解体撤去工事",
  "place": "南牧村小沢1560",
  "date": "2026年2月18日",
  "discount": -5455,
  "sections": [
    {
      "title": "1. 建物解体・撤去工",
      "items": [
        {
          "name": "木造倉庫 解体撤去費",
          "quantity": 5.2,
          "unit": "坪",
          "unitPrice": 20000,
          "note": "屋根トタン・内装材共（産業廃棄物は当社で処理）"
        },
        {
          "name": "基礎コンクリート撤去費",
          "quantity": 1,
          "unit": "式",
          "unitPrice": 30000,
          "note": "厚さ15cm以内 標準基礎"
        }
      ]
    },
    {
      "title": "2. 発生材運搬・処分費",
      "items": [
        {
          "name": "産業廃棄物 運搬処分費",
          "quantity": 1,
          "unit": "式",
          "unitPrice": 55000,
          "note": "木くず・コンガラ・廃プラ等（産業廃棄物は当社で処理）"
        },
        {
          "name": "一般廃棄物（生活ごみ）収集運搬費",
          "quantity": 0,
          "unit": "式",
          "unitPrice": 0,
          "note": "お客様自己処分。お客様自己処分が難しい場合は協議（別途）"
        }
      ]
    },
    {
      "title": "3. 諸経費・他",
      "items": [
        {
          "name": "重機回送・車両損料",
          "quantity": 1,
          "unit": "式",
          "unitPrice": 12000,
          "note": "ミニユンボ・ダンプ（自社）"
        },
        {
          "name": "現場管理費",
          "quantity": 1,
          "unit": "式",
          "unitPrice": 20000,
          "note": "諸届出・安全管理"
        },
        {
          "name": "諸雑費（燃料・消耗品等）",
          "quantity": 1,
          "unit": "式",
          "unitPrice": 4455,
          "note": "燃料・消耗品／端数調整含"
        }
      ]
    }
  ]
}
